{
  "task_id": "T-000N",
  "created_at": "2026-02-27T09:00:00Z",
  "stage": "explore",
  "goal": "Validate whether target users have a top-3 pain point around onboarding setup time.",
  "scope_in": [
    "Interview synthesis template",
    "Hypothesis definition",
    "Success threshold proposal"
  ],
  "scope_out": [
    "Production implementation",
    "Pricing strategy finalization"
  ],
  "constraints": [
    "Use existing team bandwidth only",
    "Complete within one week"
  ],
  "deadline": "2026-03-06",
  "risk_level": "medium"
}
