{
  "task_id": "T-0001",
  "created_at": "2026-03-01T14:50:00Z",
  "stage": "explore",
  "goal": "브랜치 컨벤션을 GitHub issue 추적형으로 전환하고 훅/CI/PR 템플릿/정리 전략까지 일관되게 연결한다.",
  "scope_in": [
    "브랜치 정책 문서와 기계 규칙 SoT(issue+task 이중키) 작성",
    "로컬 훅(pre-commit/pre-push) 연동",
    "CI 브랜치 게이트 + PR issue 링크 게이트 추가",
    "이슈 템플릿/PR 템플릿 추가",
    "merge 후 remote/local 정리 스크립트 반영"
  ],
  "scope_out": [
    "원격 브랜치 보호 규칙의 실제 SaaS 설정",
    "릴리즈 브랜치 전략(Git-flow) 전환"
  ],
  "constraints": [
    "기존 ADLC 수동 승인 정책 유지",
    "정책 중복 최소화(AGENTS는 라우팅 중심)",
    "로컬 훅 우회 가능성을 CI로 보완"
  ],
  "deadline": "2026-03-08",
  "risk_level": "medium"
}
